"InfluencerStandardized","standardizedCount","influencerList","platform"
"mrbeast",269,"@Mrbeast, mr  beast, mr beast, mr Beast, Mr beast, Mr Beast, MR BEAST, mr_beast, Mr. Beast, mr.beast, Mr.beast, Mr.Beast, mrbeast, mrBeast, Mrbeast, MrBeast, MRbeast, MRBeast, MRBEAST, Mrbeast., mr beest, Mrbeest, mr best, MR BREST","youtube_account"
"bankzitters",248,"Bank zitters, bankzitters, Bankzitters, Bankzitters., bankzitter, Bankzitter, bankziiter","youtube_account"
"enzoknol",189,"@enzoknol, enzo knol, Enzo knol, Enzo Knol, ENZO KNOL, Enzo Knol., enzoknol, Enzoknol, EnzoKnol, ENzoknol, ENZOKNOL, enzoknol 2, Enzoknol., enzoknol2, Enzoknolz., enzoknop, enzokol, enzokonol","youtube_account"
"undefined",148,"-, ,, ?, ????, ?????????????????, ., .., ..., /, =, 0, 1, 23, 41, 433, 45, 456, 4567, x, f1, F1, Oj, OJ, j, xx, T5G, tg,  nn, AT5, G, H, I.018l, K9, KD3, Kp, S2G, sv2","youtube_account"
"gio",105,"gio, Gio, GIO, Gio., kwo, KWO, Cho, to, wto","youtube_account"
"qucee",88,"qucee, Qucee, QUCEE, Qcee, gucee, Quecee.","youtube_account"
"stuktv",72,"stuk tv, Stuk tv, stuk-tv, stuk. tv, stuk.tv, stuktv, Stuktv, StukTV, STUKTV, Stuktv., StukTV.","youtube_account"
"jadeanna",66,"@jadeanna, jade anna, Jade anna, Jade Anna, Jade-Anna, jadeanna, Jadeanna, jade aana","youtube_account"
"stefandevries",61,"stefan de vries, Stefan de vries, Stefan de Vries, Stefan De Vries, Stefan de Vries., stefandevries, stefan vries","youtube_account"
"betasquad",60,"beta squad, Beta squad, Beta Squad, BETA SQUAD, Beta squad., Beta Squad., betasquad, Betasquad, beta sqaud, Beta squid","youtube_account"
"don",60,"don, Don, DON, Don., koen, Koen, Koen., Porn","youtube_account"
"royalistiq",53,"royalistiq, Royalistiq, Royalistiq., royalistic, rayalistiq, royalitiq, royalstiq, royavistiq","youtube_account"
"touzani",50,"touzani, Touzani, Touzani., Toezani","youtube_account"
"feyenoord",45,"feyenoord, Feyenoord, Feyenoord., fijenoord","youtube_account"
"dondejong",43,"don de jong, Don de jong, Don de Jong, DON DE JONG, Don de jong., Don de Jong., dondejong, Dondejong, don de jongh, Don de Jongh","youtube_account"
"monstertube",41,"monster tube, Monster tube, Monster Tube, monstertube, Monstertube, Monstertube.","youtube_account"
"sidemen",39,"sidemen, Sidemen, Sidemen., sideman, Sideman, Sideman., Jidemen.","youtube_account"
"rijkhofman",35,"rijk hofman, Rijk hofman, Rijk Hofman, Rijk Hofman., rijkhofman, Rijk hoffman, tijkhofman","youtube_account"
"samandcolby",33,"sam and colby, sam and Colby, Sam and colby, Sam and Colby, Sam And Colby, Sam and Colby., samandcolby, sam and cobey, Sam and coby, Sam and Cody","youtube_account"
"chatmo",32,"chatmo, Chatmo, CHATMO, chatmo 2, Chatmo 2","youtube_account"
"isae",32,"isae, Isae, ISAE, isea, ISEA, isae w","youtube_account"
"markiplier",31,"markiplier, Markiplier, Markiplier., markaplier, Markeplier, Markplier.","youtube_account"
"amp",28,"amp, Amp, AMP, AMP., zapp, Zapp","youtube_account"
"espn",26,"espn, Espn, ESPN, espn nl, Espnnl, EspnNL, ESPNL","youtube_account"
"ishowspeed",25,"I show speed., ishowspeed, Ishowspeed, IshowSpeed, IShowSpeed","youtube_account"
"msa",25,"msa, Msa, MSA, MSA., nba, Nba, NBA","youtube_account"
"laatkomers",24,"laat komers, LAAT KOMERS, laatkomers, Laatkomers, Laatkomers., laatkommers","youtube_account"
"coryxkenshin",22,"Cory x Kenshin, coryxkenshin, Coryxkenshin, CoryxKenshin, CoryXKenshin, Coryxkenshin., CoreyxKenshin, Coryxkhenshin","youtube_account"
"kleinejohn",20,"kleine john, kleine John, Kleine john, Kleine John, KLEINE JOHN, kleine jhon, KLEINE JHON","youtube_account"
"paraduze",20,"paraduze, Paraduze, Paraduze.","youtube_account"
"straykids",17,"@straykids, stray kids, Stray kids, Stray Kids, Stray kids., Stray Kids., straykids, Straykids, Straykids.","youtube_account"
"gamemeneer",17,"game meneer, gamemeneer, Gamemeneer","youtube_account"
"creachick",16,"creachick, Creachick, CreaChick, Creachick., creachic, creachik, creacick","youtube_account"
"familielakap",16,"familie lakap, Familie lakap, Familie Lakap, familielakap, familieLakap, Famillie Lakap","youtube_account"
"hanwe",16,"hanwe, Hanwe, hanwee","youtube_account"
"sturniolotriplets",16,"sturniolo triplets, Sturniolo triplets, Sturniolo Triplets, Sturniolo triplets., sturniolotriplets, Sturniolotriplets, Sturniolo triplet","youtube_account"
"glowmovies",15,"@Glowmovies, Glow movies., glowmovies, Glowmovies, glomovies","youtube_account"
"tommyinnit",14,"@Tommyinnit, tommyinnit, Tommyinnit, TommyInnit, Tommyinit","youtube_account"
"kaicenat",14,"kai cenat, Kai cenat, Kai Cenat, Kaicenat, kai canat","youtube_account"
"weetikniet",14,"weet ik niet, Weet ik niet, WEET IK NIET, weet niet, Weet niet","youtube_account"
"yarasky",13,"yarasky, Yarasky, yarsky","youtube_account"
"harm",12,"harm, Harm, arms","youtube_account"
"ssundee",12,"ssundee, Ssundee, SSundee, Ssundee., ssunddee, Ssunder","youtube_account"
"ziggosport",12,"ziggo sport, Ziggo sport, Ziggo Sport, ziggosport, Ziggosport, ziggo sports, Ziggo Sports","youtube_account"
"jordystorm",11,"jordystorm, Jordystorm, jordysrorm","youtube_account"
"kriekel",11,"kriekel, Kriekel","youtube_account"
"nee",11,"nee, Nee, NEE, geen, Geen, veel, Veel, dee, Mees, Weet","youtube_account"
"outdoorboys",11,"outdoor boys, Outdoor boys, Outdoor Boys., Outdoor-boys, outdoorboys, Outdoorbots","youtube_account"
"barz",10,"101 barz, 101 Barz, 101barz, 101Barz, boaz, Boaz, 101 Bayz., Bam.","youtube_account"
"enzo",10,"enzo, Enzo, ENZO, tenz, wenzo","youtube_account"
"giolatooy",10,"gio latooy, Gio latooy, Gio Latooy, giolatooy, gio lattoy, giolattooy","youtube_account"
"matthy",10,"matthy, Matthy, Matthy., mathy","youtube_account"
"acid",9,"acid, Acid, ACID, ACID (2)., Acid 2, ACID 2, AYD, ac/dc","youtube_account"
"airrack",9,"airrack, Airrack, Airrack., Airack","youtube_account"
"gametheory",9,"game theory, Game Theory, Game theory., GameTheory, Gametheory.","youtube_account"
"pewdiepie",9,"pewdiepie, PewDiePie, PEWDIEPIE, pewdiepei, pewdipi","youtube_account"
"prive",9,"prive","youtube_account"
"smiiy",9,"smii7y, smii7Y, Smii7y, smi77y, Smi77y, Smiity., Smiizy","youtube_account"
"twisty",9,"twisty, Twisty, Twisty., twist","youtube_account"
"voetbal",9,"voetbal, footbal","youtube_account"
"markrober",8," mark rober, @Mark Rober, mark rober, Mark rober, Mark Rober, markrobert","youtube_account"
"chainsfr",8,"chainsfr, Chainsfr, ChainsFR, chains","youtube_account"
"ferless",8,"fe4rless, Fe4rless, Fe4rLess, Fearless","youtube_account"
"frankvd",8,"frank V D, Frank vd, frankvd, Frankvd","youtube_account"
"grian",8,"grian, Grian","youtube_account"
"idk",8,"idk, ik, Ik, Mick, mick 2, Mick., dirk, pink","youtube_account"
"mystoryanimated",8,"my story animated, My story animated, MY STORY ANIMATED, mystoryanimated","youtube_account"
"ronald",8,"ronald, Ronald, ronaldo","youtube_account"
"supergaande",8,"supergaande, Supergaande, suppergande","youtube_account"
"walnut",8,"walnut, Walnut, WALNUT","youtube_account"
"ziggo",8,"ziggo, Ziggo, Ziggo., Fiago","youtube_account"
"bender",7,"@BENDER, bender, Bender, Berner415","youtube_account"
"brugklas",7,"brugklas, Brugklas TV","youtube_account"
"dailydoseofinternet",7,"daily dose of internet, Daily dose of internet, Daily Dose of Internet","youtube_account"
"dantdm",7,"Dan tdm, dantdm, Dantdm, DanTDM, dangdo","youtube_account"
"dutchtuber",7,"DUTCH TUBER, dutchtuber, Dutchtuber, Dutchtuber., dutchuber, Dutchuber","youtube_account"
"ninja",7,"ninja, Ninja","youtube_account"
"altijdmelvin",6,"altijdmelvin, Altijdmelvin","youtube_account"
"awfireworks",6,"aw fireworks, Aw fireworks, Aw Fireworks, AW fireworks","youtube_account"
"cemi",6,"cemi, Cemi, rema, Rema","youtube_account"
"danielweyers",6,"daniel weyers, Daniel Weyers., danielweyers, daniel wyers","youtube_account"
"dannyaarons",6,"Danny aarons, Danny Aarons, Danny Aarons., dannyaarons","youtube_account"
"dudeperfect",6,"dude perfect, dude-perfect, dudeperfect","youtube_account"
"dylanhaegens",6,"dylan haegens, Dylan Haegens, dylanhaegens, Dylanhaegens, DylanHaegens, dylan heagens, dylan hagens","youtube_account"
"fazerug",6,"faze rug, Faze Rug, FaZe Rug, FazeRug","youtube_account"
"fortnite",6,"fortnite, Fortnite","youtube_account"
"jacksepticeye",6,"jacksepticeye, Jacksepticeye, jackseptieye","youtube_account"
"jordanmatter",6,"jordan matter, Jordan Matter, Jordan Matter., jordanmatter","youtube_account"
"kallmekris",6,"kall me kris, kallmekris, Kallmekris, Call me Kris.","youtube_account"
"lazarbeam",6,"lazarbeam, Lazarbeam, LazarBeam, lazerbeam","youtube_account"
"makkers",6,"makkers, Makkers, de makkers, demakkers","youtube_account"
"marijnkuipers",6,"marijn kuipers, Marijn kuipers, Marijn Kuipers, martijn kuipers","youtube_account"
"nicolelaeno",6,"nicole laeno, Nicole laeno, Nicole Laeno, nicolelaeno","youtube_account"
"samsulek",6,"sam sulek, Sam Sulek, Samsaiek","youtube_account"
"svenenkoen",6,"sven en koen, Sven en koen","youtube_account"
"taylorswift",6,"Taylor swift, Taylor Swift, taylorswift, Taylorswift","youtube_account"
"auziomf",5,"Auzio MF, auziomf, Auziomf, Auzio","youtube_account"
"clix",5,"clix, Clix, ali a, ali b","youtube_account"
"clonnygames",5,"clonny games, Clonny games, clonnygames","youtube_account"
"dafuqboom",5,"Dafuq Boom, DaFuq!?Boom!, DaFuq?!Boom, DaFuq?!Boom!, dafuqboom","youtube_account"
"furtjuh",5,"furtjuh, Furtjuh","youtube_account"
"jelly",5,"jelly, Jelly, Jelly., Jell, Jolly","youtube_account"
"jidion",5,"jidion, Jidion, JiDion, Jidion.","youtube_account"
"koenweijland",5,"koen weijland, Koen Weijland, Koen weiland, Koen Weiland, koenwijland","youtube_account"
"kristysnepvangers",5,"kristy snepvangers, Kristy snepvangers, kristysnepvangers","youtube_account"
"kubzscouts",5,"kubz scouts, Kubz scouts., Kubzscouts, kubz scout, Kubzscout, Kubscoutz","youtube_account"
"mezelf",5,"mezelf, Mezelf, ikzelf","youtube_account"
"milanknol",5,"milan knol, Milan knol, milanknol, Milanknol","youtube_account"
"misterbeast",5,"mister beast, misterbeast, Misterbeast, MsterBeast","youtube_account"
"mongraal",5,"mongraal, Mongraal, Mingraal","youtube_account"
"mrsavage",5,"Mr Savage, mrsavage, Mrsavage, MRsavage","youtube_account"
"onnedi",5,"onnedi, onneDi, Onnedi, onedi, Onnedie","youtube_account"
"theboys",5,"the boys, The boys, The Boys, The boys., Theboys","youtube_account"
"whopcap",5,"whopcap, Whopcap","youtube_account"
"ranboo",4,"@Ranboo, ranboo, Ranboo.","youtube_account"
"acookiegod",4,"acookiegod, cookie god, cookiegod, Cookiegod., acoockiegod","youtube_account"
"afcajax",4,"afc ajax, Afc ajax, Afc Ajax, AFC Ajax","youtube_account"
"bellingas",4,"Bellinga's, Bellinga´s, bellingas, bellinga","youtube_account"
"benoftheweek",4,"Benoftheweek, Benoftheweek.","youtube_account"
"boos",4,"boos, Boos, BOOS, boef, Boef, boom","youtube_account"
"bts",4,"bts, BTS, bt1, Bt1, beta","youtube_account"
"celinaspookyboo",4,"celinaspookyboo, Celinaspookyboo, CelinaSpookyboo","youtube_account"
"courtreezy",4,"courtreezy, Courtreezy, Courtreezy.","youtube_account"
"dancemoms",4,"dance moms, Dance moms, dancemoms","youtube_account"
"dashiegames",4,"dashiegames, DashieGames","youtube_account"
"dazgames",4,"daz games, Daz games, Daz-Games, dazz games","youtube_account"
"divaio",4,"divaio, Divaio, divajo, Divao","youtube_account"
"dream",4,"dream, Dream","youtube_account"
"formula",4,"formula 1, Formula 1, formula1, Formula1, formule 1","youtube_account"
"gewoonthomas",4,"gewoon thomas, GEWOON THOMAS, gewoonthomas, GewoonThomas","youtube_account"
"giel",4,"giel, Giel, Giel., ties","youtube_account"
"hooligirls",4,"hooligirls, hooligurls","youtube_account"
"jperm",4,"J perm, J Perm, j-perm, Jperm, Jerma985","youtube_account"
"jemoeder",4,"je moeder, Je moeder, jemoeder, Jemoeder, enjemoeder","youtube_account"
"jeugdjournaal",4,"jeugdjournaal, Jeugdjournaal","youtube_account"
"juniorsongfestival",4,"junior songfestival, Junior Songfestival, juniorsongfestival","youtube_account"
"kalvijn",4,"kalvijn","youtube_account"
"linktijger",4,"linktijger, Linktijger","youtube_account"
"niks",4,"niks, Kiss, Sims 4","youtube_account"
"parrot",4,"parrot, Parrot","youtube_account"
"plodno",4,"plodno, Plodno","youtube_account"
"raoul",4,"raoul, Raoul, RADAL","youtube_account"
"rutgerenthomas",4,"rutger en thomas, Rutger en Thomas","youtube_account"
"sb",4,"sb-737, sb737, SB737, SBS, sbs6, SBS6, Sml, SNL, soz","youtube_account"
"slotta",4,"slotta, Slotta","youtube_account"
"socksfor",4,"socksfor1, Socksfor1, socksfor3, Socksfor3, Sockfor1","youtube_account"
"timtygran",4,"tim tygran, Tim Tygran","youtube_account"
"tuonto",4,"tuonto, Tuonto, Tuonto.","youtube_account"
"vogue",4,"vogue","youtube_account"
"blackpink",3,"@blackpink, blackpink","youtube_account"
"nosjeugdjournaal",3,"@NOS jeugdjournaal, nos jeugdjournaal, NOS jeugdjournaal","youtube_account"
"tubbo",3,"@Tubbo, tubbo, Tubbo","youtube_account"
"bitryan",3,"8-bitryan, 8bitryan, 8bitRyan","youtube_account"
"ajax",3,"ajax, Ajax, Adam","youtube_account"
"alexklein",3,"Alex klein, alexklein, Alexklein, Alex h Klein","youtube_account"
"alexpoatanpereira",3,"alex poatan pereira","youtube_account"
"anass",3,"anass, annas, Annas","youtube_account"
"andrewtate",3,"Andrew tate, Andrew Tate, Andrew Tate.","youtube_account"
"arjenlubach",3,"arjen lubach, Arjen Lubach","youtube_account"
"benderbij",3,"benderbij, Benderbij","youtube_account"
"berleezy",3,"berleezy","youtube_account"
"billieeilish",3,"billie eilish, Billie eilish, Billie Eilish","youtube_account"
"blooprint",3,"blooprint, Blooprint","youtube_account"
"boeie",3,"boeie, roedie, roelie","youtube_account"
"bokado",3,"bokado, Bokado","youtube_account"
"cboys",3,"c-boys, cboys, Cboys, cdboys","youtube_account"
"cboystv",3,"cboys tv, cboystv","youtube_account"
"cristiano",3,"cristiano","youtube_account"
"daiz",3,"Daiz, Dani, Daz, DAZN","youtube_account"
"dannygonzalez",3,"danny gonzalez, Danny Gonzalez, dannygonzalez, danny gonzales","youtube_account"
"debsmikle",3,"deb smikle, Deb smikle., deb smikel","youtube_account"
"dellavlogs",3,"della vlogs, Della vlogs","youtube_account"
"dharman",3,"dhar man, Dhar Man, dhar mann, DHAR MANN, Dharman, Dharmann., dharr man, Dharr mann.","youtube_account"
"djuncan",3,"Djuncan, duncan, Duncan, Djucan","youtube_account"
"efteling",3,"efteling, Efteling","youtube_account"
"fcroelie",3,"fc roelie, FC roelie, FCRoelie, fcroellie","youtube_account"
"flamingo",3,"flamingo, Flamingo","youtube_account"
"fog",3,"fog, FOG, FOG11, fng, Log, tgg","youtube_account"
"freepalestina",3,"Free Palestina","youtube_account"
"funnymike",3,"funnymike, Funnymike","youtube_account"
"fusionzgamer",3,"FusionZgamer, FusionZGamer, Fusionzgamer.","youtube_account"
"galatasaray",3,"galatasaray, Galatasaray","youtube_account"
"gamesreal",3,"games4real, Games4real, game4real","youtube_account"
"geeneen",3,"geen een, geen zin, geen zun","youtube_account"
"geenidee",3,"geen idee","youtube_account"
"goodtimeswithscar",3,"Goodtimeswithscar, GoodtimeswithScar","youtube_account"
"graystillplays",3,"graystillplays, Graystilplays, Grey still plays","youtube_account"
"hopescope",3,"hopescope, Hopescope, Horoscope.","youtube_account"
"ikweetdenaamniet",3,"ik weet de naam niet","youtube_account"
"jarnoopmeer",3,"Jarno opmeer, Jarno Opmeer","youtube_account"
"jevader",3,"je vader, Je vader, jevader","youtube_account"
"jeremyfrieser",3,"jeremy frieser, jeremyfrieser","youtube_account"
"jmancurly",3,"jmancurly, Jmancurly","youtube_account"
"joelbeukers",3,"joel beukers","youtube_account"
"juliaheetman",3,"julia heetman, Julia heetman","youtube_account"
"justkass",3,"justkass, Justkass","youtube_account"
"kingalmightyyy",3,"kingalmightyyy, Kingalmightyyy, KingAlmightyyy, kingalmightyy, kingalmithyyy","youtube_account"
"kittadiy",3,"kitta diy, Kitta diy., kittadiy, Kitty Diy","youtube_account"
"ksi",3,"ksi, KSI, Goi, kai","youtube_account"
"lanadelrey",3,"lana del rey, Lana del rey","youtube_account"
